business_id:ID(restaurant),name,address,city,stars,review_count,categories,RangePrice,Ambiences,Nb_Ambiences,Nb_categories
jCyQknyt1mkMTBw60-ABUw,McDonald's,2507 Concord Pike,Wilmington,2.0,32,"Restaurants, Coffee & Tea, Fast Food, Food, Burgers",1.0,[],0,5
_LoYXMFxkbmrpAP74d81Dw,Tropical Smoothie Cafe,3252 Fashion Center Blvd,Newark,2.5,12,"Restaurants, Sandwiches, Juice Bars & Smoothies, Food",,[''],1,4
ylkgMTVWMvliW9x-XlbjvA,Famous Dave's Bar-B-Que,303 Rocky Run Pkwy,Wilmington,3.5,51,"Restaurants, Comfort Food, American (Traditional), Event Planning & Services, Caterers, Barbeque",2.0,['casual'],1,6
kvb0a9FiFs9UXWxE6q-5DA,Naaman's Pizzeria,"3100 Naamans Rd, Ste 9",Wilmington,4.5,34,"Restaurants, Pizza",1.0,['casual'],1,2
Qp_6nULBg80xhx8ksMYAHQ,Utage Japanese Restaurant,"1601 Concord Pike, Ste 59",Wilmington,4.0,5,"Japanese, Restaurants",3.0,[''],1,2
ajFL2FsdDZQwwpiOVeh1nQ,Pomodoro Restaurant,729 N Union St,Wilmington,3.0,10,"Restaurants, Italian",2.0,[],0,2
-PTWFicakClBDK-zyQ5hjA,First Watch,74 Geoffrey Dr,Newark,4.0,166,"Cafes, Breakfast & Brunch, American (Traditional), American (New), Restaurants",2.0,"['hipster', 'casual', 'trendy']",3,5
uPngSFlKQmQT3v8h8aTwmA,Luigis Pizzeria,14 Carpenter Plz,Wilmington,3.0,25,"Pizza, Restaurants",2.0,[],0,2
ERov0fZxnWhM-2GYFY2i9Q,Unique Chinese,1401 Philadelphia Pike,Wilmington,2.5,20,"Japanese, Chinese, Restaurants",1.0,[],0,3
xHi_onbMgQqj86HFfDiqsw,Royal Farms,457 Stanton Christiana Rd,Newark,3.5,9,"Fast Food, Restaurants, Convenience Stores, Gas Stations, Food, Automotive",,[''],1,6
I3yzZhtKfRMuUHWHDBqHGA,Capriotti's Sandwich Shop,510 N Union St,Wilmington,3.5,46,"Restaurants, Sandwiches, Delis, Salad, Soup",1.0,[],0,5
v1VKIvac73Fxt6BMiuKiTA,Lawerence Pizza & Restaurant,801 Churchmans Road Ext,New Castle,3.5,14,"Restaurants, Pizza, Italian",2.0,[],0,3
HQdoy8OpEuGKM_Op-ovHFQ,Skipjack Dining,401 Louviers Dr,Newark,4.0,109,"Cocktail Bars, Restaurants, American (New), Seafood, Bars, Nightlife",2.0,['casual'],1,6
alM80dgR9izB_svltTw1Nw,Argilla Brewing,2667 Kirkwood Hwy,Newark,3.5,148,"Food, Restaurants, Bars, Pubs, Nightlife, Breweries, Pizza",2.0,['casual'],1,7
YkL_44nF4_jUDm3cyq5SJw,China King,4307 Kirkwood Hwy,Wilmington,3.0,19,"Chinese, Restaurants",1.0,['divey'],1,2
rl77SOSsmY-jklKpTm3jWw,Public House Wilmington,902 N Market St,Wilmington,3.0,23,"Restaurants, American (New), Nightlife",2.0,[],0,3
NlkFNuYkreoPvrThNQEvbw,Docklands Riverfront,110 West St,Wilmington,3.5,72,"Venues & Event Spaces, Restaurants, Event Planning & Services, Nightlife, American (New), Bars",2.0,[],0,6
EUTf-d0OVBMyPkg3lObG6w,Famous Famiglia,530 Jfk Memorial Hwy,Newark,3.0,7,"Restaurants, Fast Food, Pizza",2.0,[],0,3
X0lMkTXVs3PLcyKzQ6GTcw,Maiale,"3301 Lancaster Ave, Ste 3D",Wilmington,4.5,65,"Restaurants, Sandwiches, Delis, Salad, Breakfast & Brunch",2.0,['casual'],1,5
JogSG9qSX7rRN1qioMhYeg,The Ice Cream Shoppe,700 Philadelphia Pike,Wilmington,4.0,11,"Food, Ice Cream & Frozen Yogurt, Sandwiches, Pretzels, Desserts, Hot Dogs, Restaurants",1.0,[''],1,7
DXdqMi16GRc7oMUSFmjIfA,Kidds Chicken And Waffles,301 N Pine St,Wilmington,2.5,5,"Food, Specialty Food, American (New), Restaurants",1.0,[],0,4
IZgQel8rfyLY8r69GtnUQg,Ike's Artisan Pizza,4569 New Linden Hill Rd,Wilmington,4.5,8,"Wraps, Chicken Wings, Restaurants, Pizza, Cheesesteaks",,[''],1,5
adVbOEChtDwsLF6k_Quczw,Country Maid Deli-Jack's,2400 Kirkwood Hwy & Millt,Wilmington,3.0,13,"Delis, Restaurants",1.0,[],0,2
-eKoPT80NewUNc2h-hevdA,Harvest House,1204 N Washington St,Wilmington,4.5,46,"Coffee & Tea, American (New), Restaurants, Food, Juice Bars & Smoothies",2.0,[],0,5
qCVbvgYjJkdsrSN71Ra0Ew,The Crow Bar,1711 Delaware Ave,Wilmington,3.5,27,"Bars, Pizza, Restaurants, Chicken Wings, Nightlife, Cocktail Bars, Greek",,['classy'],1,7
hJ0QkeOdQ5y7MTmdR9NO1Q,The Copper Dram,3826 Kennett Pike,Greenville,4.5,56,"Beer, Wine & Spirits, Cocktail Bars, American (New), Bars, Food, Nightlife, American (Traditional), Restaurants",2.0,"['casual', 'romantic', 'upscale']",3,9
TU3rjb_t9OVLoxVJpwEhwA,Sheraton Suites Wilmington Downtown,422 Delaware Ave,Wilmington,3.0,82,"Restaurants, Hotels & Travel, Event Planning & Services, Hotels, Venues & Event Spaces",2.0,[],0,5
T3zMecCY619BrWOg-fi7lA,Extreme Pizza - Wilmington,201 N Market St,Wilmington,2.5,69,"Pizza, Restaurants, Salad, Sandwiches",2.0,['casual'],1,4
hN4B1kS8J5MQykKxrYXB_g,Wheelys Cafe,"791 Frenchtown Rd, Penn Farm",New Castle,4.5,10,"Restaurants, Cafes, Vegan, Waffles, Breakfast & Brunch",,[],0,5
aAPiZY_6_xb2qSMs0ABBpg,Tasti Thai,287 Christiana Rd,New Castle,3.5,124,"Thai, Restaurants",2.0,['casual'],1,2
2ZaldC7ird5-K9sSvK6tIw,Chipotle Mexican Grill,3700 Kirkwood Hwy,Wilmington,2.0,36,"Restaurants, Mexican, Fast Food",1.0,[],0,3
aiJg1ucX4IoeWFwKTNZcsA,Boston Market,3130 Kirkwood Hwy,Wilmington,3.0,10,"Comfort Food, Restaurants, Event Planning & Services, Chicken Shop, Caterers, American (Traditional), Sandwiches",1.0,[''],1,7
yfKe5Ne8oo4jEBXiZvr__g,Hak's Restaurant,1050 S Market St,Wilmington,2.0,6,"Sports Bars, Bars, Restaurants, Adult Entertainment, Nightlife",2.0,[''],1,5
rwPdi2Ept5LcVYIRUjj53Q,Angel's Restaurant,2222 Silverside Rd,Wilmington,4.0,38,"Restaurants, Diners, American (Traditional)",1.0,['casual'],1,3
BKVwN2btBPovpWis42Urlg,Kozy Korner Restaurant,906 N Union St,Wilmington,4.0,48,"Breakfast & Brunch, Restaurants, Diners, Sandwiches",1.0,['casual'],1,4
DZG3652AxmIUGmlF-hg3mw,Bertucci's Italian Restaurant,3610 Concord Pike,Wilmington,3.5,67,"Pizza, Gluten-Free, Restaurants, Italian",2.0,['casual'],1,4
pOQGEGN_UrH8rtKea0WKRA,Tropical Smoothie Cafe,4742 Limestone Rd,Wilmington,4.0,26,"Juice Bars & Smoothies, Sandwiches, Cafes, Wraps, Breakfast & Brunch, Food, Restaurants, Internet Cafes",,[],0,8
UgdwL5wCdaFe84wmXmwaFg,Minato Japanese Restaurant,101 W 8th St,Wilmington,3.0,9,"Restaurants, Japanese",2.0,[],0,2
qdKCj1XsTCgTql1iuPB5lg,Marsh Road Diner,407 Marsh Rd,Wilmington,3.5,92,"Restaurants, Diners, Cafes, Breakfast & Brunch",1.0,['casual'],1,4
a-YvWwzkAd-w6VWsW0sEhQ,Jimmy John's,"824 N Market St, Ste 105",Wilmington,3.0,15,"Restaurants, Food, Fast Food, Sandwiches, Food Delivery Services, Delis",1.0,[''],1,6
Jmk_N22L1iQ6-EZIlexqag,La Tlaxquenita,218 New Castle Ave,New Castle,5.0,7,"Restaurants, Food, Convenience Stores, Mexican",2.0,[],0,4
qRB4CzTnQy6iOO4D1FT4kg,Two Cousins Pizza,7460 Lancaster Pike,Hockessin,3.0,60,"Pizza, Restaurants",1.0,['casual'],1,2
Yh0HF45_lVXa6gSSKsJY1w,Jimmy John's,1111 Churchmans Rd,Newark,3.0,16,"Delis, Fast Food, Sandwiches, Restaurants",1.0,[''],1,4
JCXcdCGpqIRXEGzhPukdsg,Porto-Fino Pizza & Restaurant,730 Ferry Cut Off St,New Castle,4.0,38,"Italian, Restaurants, Pizza",2.0,['casual'],1,3
FyPqFGQXuX7Jkrjm6LoC0Q,Great Wall,4553 New Linden Hill Rd,Wilmington,2.5,20,"Restaurants, Chinese",2.0,[],0,2
Y8iVXWq_C-U3POZ6yItw7Q,Chili's,3220 Fashion Center Blvd,Newark,2.0,57,"Restaurants, American (Traditional), Tex-Mex, Food, Bars, Nightlife",2.0,['casual'],1,6
4Co0fjkcBvNpUY1z-tg67g,Mrs Snyder's,414 Delaware St,New Castle,4.0,7,"Restaurants, Bakeries, American (Traditional), Breakfast & Brunch, Food",,[''],1,5
2XEXr1Ba8V8qN4IGADNliA,Kukurukoo Express,101 W Market St,Wilmington,3.5,12,"Mexican, Restaurants",2.0,[],0,2
WM18UYsMn4EOwc1s1cCoAg,China Inn,216 New Castle Ave,New Castle,2.0,6,"Restaurants, Chinese",1.0,[''],1,2
ElEbumta2ujV9PTx4OGbVw,Columbus Inn,2216 Pennsylvania Ave,Wilmington,3.5,144,"American (New), Italian, Venues & Event Spaces, Nightlife, Event Planning & Services, Bars, Breakfast & Brunch, Cocktail Bars, Restaurants, Seafood",2.0,['classy'],1,10
gu4TEXWfC69ZVrKDsVPtKQ,Chaiyo Sushi and Thai Cuisine,1724 W Newport Pike,Wilmington,4.0,36,"Japanese, Thai, Sushi Bars, Asian Fusion, Restaurants",2.0,['casual'],1,5
z-2pRvQXAWqcZdLW2fKj9g,Deerhead Hot Dogs,620 S Maryland Ave,Wilmington,3.5,20,"Sandwiches, Hot Dogs, Restaurants, Burgers",1.0,[],0,4
NXYydDGZuz3p2AGg4puqig,Cuzino's Pizza & Pasta,188 Penn Mart Shopping Ctr,New Castle,3.0,13,"Pizza, Restaurants",1.0,[''],1,2
FYOPKSHyRVYwqjNayJdIPA,King Garden Chinese Restaurant,3466 Naamans Rd,Wilmington,3.5,33,"Restaurants, Chinese",1.0,['casual'],1,2
-6eomXaFuOSKPsUbk2A3xQ,The Crownery Chinese Restaurant,228 Lantana Dr,Hockessin,3.0,70,"Restaurants, Chinese",2.0,['casual'],1,2
yFxxhrdtDfmNF4xcXeem8A,Takumi,1601 Concord Pike,Wilmington,3.5,193,"Chinese, Sushi Bars, Japanese, Restaurants",2.0,['classy'],1,4
vep5L_9i_xFaCm2bZvQemg,Days Inn by Wyndham Newark Wilmington,900 Churchmans Road,Newark,2.0,18,"Restaurants, Event Planning & Services, Hotels, Hotels & Travel",2.0,[''],1,4
UWQn01BHc7jJnjDx6y-n9Q,Boston Market,300 University Plz,Newark,3.5,12,"American (Traditional), Restaurants, Chicken Shop, Sandwiches, Comfort Food, Caterers, Event Planning & Services",1.0,[],0,7
reHlvRPArBEo4RatrXZQNg,Bella Italy,4817 Governor Printz Blvd,Wilmington,2.5,15,"Pizza, Restaurants",2.0,[],0,2
8IazNnZkqYlNODBZPS1CGA,Wawa,183 Airport Rd,New Castle,2.0,7,"Food, Coffee & Tea, Convenience Stores, Restaurants, Sandwiches",1.0,[''],1,5
_ZG6xLrZ7VIfcQS_tl0Mpg,Cotti's Pizza,7313 Lancaster Pike,Hockessin,4.0,11,"Wraps, Pizza, Restaurants, Sandwiches",,[],0,4
Qz6-OxFp9PhGwMZG5geqpw,Touch Of Italy,2530 Concord Pike,Wilmington,3.5,158,"Italian, American (New), Restaurants",2.0,"['classy', 'casual']",2,3
L-NBC1etnxAvHP_u2xo4Ow,Moe's Southwest Grill,5311 Brandywine Pkwy,Wilmington,2.5,46,"Mexican, Tex-Mex, Restaurants",1.0,[],0,3
9pPK-EhpT9jkC7WXdtDM-w,Seasons Pizza,3901 Concord Pike,Wilmington,3.0,46,"Caterers, Restaurants, Chicken Wings, Italian, Event Planning & Services, Pizza",1.0,['casual'],1,6
iWyYWFXrOvyoxIvUPf8OuA,Opa Opa,7 A Trolley Sq,Wilmington,4.0,119,"Mediterranean, Greek, Restaurants",1.0,['casual'],1,3
P_nqb7lULOtx3pAJbKfFXA,Santa Fe Mexican Grill - Wilmington,2006 Pennsylvania Ave,Wilmington,3.5,74,"Restaurants, Mexican, Nightlife",2.0,['casual'],1,3
sRJFxyCjZnmXuZLk6uKW6Q,Panera Bread,715 Christiana Mall Rd,Newark,2.5,35,"Food, Restaurants, Breakfast & Brunch, Bakeries, Sandwiches, Coffee & Tea, Bagels, Cafes, Soup, Salad",2.0,['casual'],1,10
cVWOVdiHpPRzuS2FSQUgfA,Omka Grill & Sushi,"3301 Lancaster Pike, Unit 1C",Elsmere,4.5,20,"Sushi Bars, Restaurants, Wholesalers, Professional Services, Japanese, Restaurant Supplies",,[],0,6
3omPdJWZzRAaNZU4vaovZQ,Food For Thought Catering,"408 Philadelphia Pike, Ste 1",Wilmington,4.5,10,"Restaurants, Caterers, Barbeque, Event Planning & Services",2.0,[''],1,4
S_i39mHBCZadtvwdC6Hb6Q,Seasons Pizza,615 S Maryland Ave,Wilmington,2.0,19,"Italian, Restaurants, Chicken Wings, Pizza",2.0,[],0,4
mcmOeaoHlryrtogjd3tooQ,La Fia,421 N Market St,Wilmington,4.0,177,"Cafes, Specialty Food, Bakeries, American (New), Restaurants, Food, Italian",2.0,['trendy'],1,7
DvKVx_Em_UkG2NPeeKSJzg,Sitaly To Go,1806 Marsh Rd,Wilmington,4.0,23,"Pizza, Restaurants",,[''],1,2
NTlF55qiq2TCxR_2Kr4NAA,Star of India,1710-A Newport Gap Pike,Wilmington,4.0,44,"Indian, Restaurants",2.0,[],0,2
015DpGQSGAjbHfa7KE-p5A,Domino's Pizza,1202 Delaware St,New Castle,3.0,9,"Pizza, Restaurants",1.0,[],0,2
xSaH011Ov02w-8sxr78M6Q,New Dragon Restaurant,707 Ace Memorial Dr,Hockessin,4.0,12,"Restaurants, Chinese",1.0,['casual'],1,2
ZjwEfrsA2bztSk9SLrPqPA,Kung Fusion Asian Grill,1714 Marsh Rd,Wilmington,3.0,32,"Sushi Bars, Restaurants, Chinese, Asian Fusion",2.0,['casual'],1,4
KzGXMHnlrknUhEjNyD8yZQ,Pho Cali,4373 Kirkwood Hwy,Wilmington,3.5,126,"Food, Specialty Food, Vietnamese, Ethnic Food, Restaurants",1.0,['casual'],1,5
2y2LhpdlHuGU6bkAHFSoQg,Wawa,2621 Philadelphia Pk,Claymont,3.5,26,"Food, Restaurants, Coffee & Tea, Sandwiches, Convenience Stores",1.0,[],0,5
fNd-tOJGusNDcT0Kqzikaw,Indian Hut,1253 Churchmans Rd,Newark,2.5,22,"Indian, Restaurants",,[],0,2
AHQSq5ZdYVQUleXgPwHHhg,Teriyaki Madness,3311 Concord Pike,Wilmington,3.5,27,"Chinese, Japanese, Gluten-Free, Asian Fusion, Restaurants",,[''],1,5
jAwmIPk8p2c2kxAbL7Ocyw,Sansone's Seafood Market,7th & Lincoln St,Wilmington,4.0,24,"Seafood Markets, Seafood, Restaurants, Specialty Food, Food",2.0,[''],1,5
bbm5_njEZyw68E7UUY0xgQ,Red Robin Gourmet Burgers and Brews,101 W Main St,Christiana,3.0,86,"American (Traditional), Beer, Wine & Spirits, Burgers, Restaurants, Food",2.0,['casual'],1,6
4lVR4qfWaX-wn1v4EakF8A,Barcelona Pizza,3322 Old Capitol Trl,Wilmington,4.5,28,"Pizza, Chicken Wings, Restaurants, Cheesesteaks",2.0,['casual'],1,4
jJKvRg2tYr7qWP-VxdjCTQ,The Back Burner,425 Hockessin Corner,Hockessin,3.5,91,"Food, American (New), Seafood, Restaurants",2.0,"['intimate', 'classy']",2,4
PGFzlPVRUz2rpR9DRAU7dQ,Murph's Irish Pub,401 Philadelphia Pike,Wilmington,3.5,5,"Bars, Nightlife, Pubs, Irish, Dive Bars, Restaurants",1.0,[],0,6
leaEzQ7Uz_7NID4vpx9RCQ,Juliana's Kitchen,1828 W 11th St,Wilmington,4.5,188,"Restaurants, Peruvian, Latin American",2.0,['casual'],1,3
vVLLNrqhvrkVXfIIW9Etag,Timothy's On the Riverfront,930 Justison St,Wilmington,2.5,138,"American (Traditional), Restaurants",2.0,['casual'],1,2
xNZj9zMVY7NizZyBn41BvA,Tropicalia,1701 W 4th St,Wilmington,4.0,10,"Caribbean, Restaurants, Dominican",1.0,[],0,3
Wz687hCcjVyHTCP-jd6U_Q,Gyro King,4130 Ogletown Stanton Rd,Newark,4.0,61,"Restaurants, Mediterranean, Greek, Moroccan",1.0,['casual'],1,4
imCIha88DmlxaWpXScRkZw,Buffalo Wild Wings,501 Stanton Christiana Rd,Newark,2.0,41,"Nightlife, Restaurants, Chicken Wings, American (Traditional), Sports Bars, Bars",2.0,"['trendy', 'casual']",2,6
0CeoONLXqseUxPdGerefOQ,Mexican Post,3100 Naamans Rd,Wilmington,3.5,131,"Food, Mexican, Breakfast & Brunch, Restaurants, Desserts",2.0,['casual'],1,5
DoHkrJJVPffu924i6MLtcg,Applebee's Grill + Bar,1600 Rocky Run Pkwy,Wilmington,2.0,46,"American (Traditional), Bars, Steakhouses, Restaurants, Sports Bars, Nightlife, American (New), Fast Food, Burgers",2.0,['casual'],1,9
j7LZM6rf4Bf33exo6XXKGA,Drop Squad Kitchen,928 Justison St,Wilmington,4.0,282,"Soul Food, Vegetarian, Restaurants, Ice Cream & Frozen Yogurt, Vegan, Juice Bars & Smoothies, Food",2.0,['casual'],1,7
RLB-RxkiAcY4pwjTYUzpEA,Osaka Express,23 Penn Mart Ctr,New Castle,3.0,13,"Restaurants, Specialty Food, Japanese, Sushi Bars, Food",1.0,[],0,5
bS2clitvOuAuxFKxA0YnXA,Friendly's,2670 Kirkwood Highway,Newark,2.5,12,"Food, Restaurants, Burgers, Ice Cream & Frozen Yogurt, American (Traditional)",1.0,[],0,5
71UVaCN8AtyovlqoS0Hixg,La Tolteca - Wilmington,4147 Concord Pike,Wilmington,3.0,201,"Latin American, Mexican, Restaurants, Tex-Mex",2.0,['casual'],1,4
JaJDxNxLsV4h_Nkt7HsMAA,Goober’s Diner,1203 N Lincoln St,Wilmington,3.5,34,"American (Traditional), Sandwiches, Salad, Diners, Restaurants",,[''],1,5
7sdNASlBZhZMQalQUKB4ug,Chili's,425 Stanton Christiana Rd,Newark,2.0,20,"Restaurants, Tex-Mex, Nightlife, Bars",2.0,[],0,4
Rgp0ZBmxRjf0pqqVnvzm8w,Cafe Palermo,3612 Miller Rd,Wilmington,3.5,21,"Italian, Pizza, Restaurants",2.0,[],0,3
jWmg60gRRnNhaHQyc2W8Og,OMY Smoked BBQ,"4737 Concord Pike, Ste 810",Wilmington,3.5,9,"Restaurants, Filipino, Barbeque",,[''],1,3
bn0XzKxBRBWvnHUMg5cz6g,Red Lobster,"1249 New Churchman's Rd, CENTER POINTE PLAZA",Newark,2.5,59,"American (Traditional), Seafood, Restaurants",2.0,['casual'],1,3
dz3dov1RfT25X_StP__cdQ,Little Caesars Pizza,3613 Kirkwood Hwy,Wilmington,2.0,13,"Sandwiches, Pizza, Restaurants",1.0,[],0,3
7NZ8Uq7Xtx4i7MR--1IjNA,Tierra Mexi Cali Grill,"4710 Limestone Rd, Ste 200",Wilmington,4.0,62,"Restaurants, Mexican",1.0,['casual'],1,2
R36Rhjk95Jh70scUravEQw,Biryani City,270 University Dr,Newark,3.5,90,"Restaurants, Indian, Halal, Vegetarian, Pakistani",2.0,"['classy', 'casual']",2,5
L7wxBug8MF-Ag-u43DkQpg,Cactus Cantina,211 W 9th St,Wilmington,3.5,23,"Mexican, Restaurants",2.0,['casual'],1,2
FtN_ctIlpuTcAInNIMiM1g,Taqueria Jalisco,1722 W Gilpin Dr,Wilmington,4.5,16,"Mexican, Restaurants",,[],0,2
DCJefHxEStVHnX8acaq0xA,Jeenwong Thai Cuisine,3 S Orange St,Wilmington,3.5,20,"Thai, Restaurants",1.0,['casual'],1,2
jwp7_9S5IslgXnA7udfkYQ,Taj Mahal Restaurant,2314 Carpenter Station Rd,Wilmington,4.0,70,"Buffets, Indian, Seafood, Restaurants, Halal",2.0,['casual'],1,5
qwIF7ZBgyP01Cdt53aYS3w,Burgers by Wildwich,2308 Concord Pike,Wilmington,3.5,10,"Event Planning & Services, Food, Burgers, Restaurants, Caterers, Food Trucks, Sandwiches",1.0,[],0,7
8tccha-xTkuNLiPfJYACXQ,Market Street Grill,4304 N Market St,Wilmington,3.5,9,"American (Traditional), American (New), Soul Food, Restaurants, Breakfast & Brunch",,[],0,5
mnyk_gnb60vFB2o6Y8c2Gw,Rocco Italian Grill & Sports Bar,701 N Union St,Wilmington,4.0,87,"Nightlife, Sports Bars, Bars, Pizza, Italian, Restaurants",2.0,['casual'],1,6
P7p-rYAkkOnPURxXx3Tg8g,Bella Luna,729 N Union St,Wilmington,4.0,17,"Salad, Pizza, Italian, Restaurants",2.0,[],0,4
N8NB7lMryKMMf6SJUvzYVQ,Tony's Cafe,366 Possum Park Rd,Newark,4.0,66,"Pizza, Caterers, Italian, Cafes, Restaurants, Event Planning & Services",1.0,['casual'],1,6
z9xBQXT6Ru19ySOjdGDIqw,Dunkin',701 Philadelphia Pike,Wilmington,3.0,9,"Bagels, Donuts, Restaurants, Food, Coffee & Tea",1.0,[''],1,5
pOCjLcWQskQjRPi6zdLvAw,Centreville Cafe,5800 Kennett Pike,Wilmington,4.0,35,"Restaurants, Cafes",1.0,['classy'],1,2
OwBgQo86CL2GmGX0OIUEEw,The Cheesecake Factory - Newark,350 Christiana Mall,Newark,3.0,263,"Food, American (New), American (Traditional), Restaurants, Desserts, Seafood, Salad",2.0,['casual'],1,7
SwDn4LYC7uzQMmIz8RMBBg,Corner Bistro,3604 Silverside Rd,Wilmington,4.0,200,"American (New), Restaurants",2.0,"['classy', 'casual']",2,2
leBpyQruds138tREAfRvzA,Libbys Restaurant,227 W 8th St,Wilmington,4.0,47,"Restaurants, American (Traditional), Sandwiches",1.0,['casual'],1,3
gDc_CGQD__1IqL79TaUKrg,ShopRite of Christina Crossing,501 S Walnut St,Wilmington,2.5,31,"Food, Restaurants, Bakeries, Delis, Grocery",2.0,[''],1,5
prjS_8VAw65e32UtoCj5AA,Seasons Pizza,1524 Philadelphia Pike,Wilmington,2.0,28,"Chicken Wings, Restaurants, Pizza, Italian",1.0,[],0,4
4wvKerRd-Y88IX6E5lCArQ,George's Restaurant,703 Philadelphia Pike,Wilmington,3.5,19,"Waffles, American (Traditional), Breakfast & Brunch, Restaurants",2.0,[],0,4
CcxT3qxaAm9_3-q2h9zt_Q,Champps Restaurant and Bar,4737 Concord Pike,Wilmington,2.5,8,"Restaurants, American (Traditional)",2.0,[],0,2
15IzVzKuvUCrpM1AFvDT_A,Brew Haha,27 Trolley Sq,Wilmington,3.0,7,"Food, Coffee & Tea, Restaurants",1.0,[''],1,3
n7XtDJQVnxb1UzPPzlOlHQ,El Diablo Burritos,1826-1828 Marsh Rd,Wilmington,4.5,171,"Restaurants, Fast Food, Mexican, Tex-Mex, Tacos",1.0,"['classy', 'casual']",2,5
d6CkVTvgiU-U-kLR1Mj09Q,Taqueria El Amigo,224 W Market St,Newport,4.5,16,"Mexican, Restaurants",,[],0,2
ikqbPYXQNLIvfz0kymBnJA,Romano's Macaroni Grill,4157 Concord Pike,Wilmington,2.5,66,"Restaurants, Italian",2.0,['casual'],1,2
nHHOQf2pjLT5jUvkG-4DHw,Wendy's,4300 Kirkwood Hwy,Marshallton,2.0,12,"Fast Food, Restaurants, Burgers",1.0,[''],1,3
4orl8-9N6Opr9FJjpsSVCw,Padi,700 Lantana Dr,Hockessin,2.5,23,"Sushi Bars, Thai, Asian Fusion, Restaurants",2.0,[],0,4
r3dO-D1qFn4Jct7KDNvImg,LOMA Coffee,239 N Market St,Wilmington,4.5,143,"Coffee & Tea, Sandwiches, Restaurants, Food, Breakfast & Brunch",1.0,"['hipster', 'casual']",2,5
Wo1nGE9JL8U8MloV1OaiBg,Pupuseria Salvadoreña,101 Kirkwood Sq,Wilmington,4.0,29,"Salvadoran, Food, Latin American, Restaurants",2.0,[],0,4
vLiXVP1WHdilv13s5SnnQQ,Bachetti Bros,4723 B Kirkwood Hwy,Wilmington,4.5,24,"Sandwiches, Butcher, Meat Shops, Delis, Event Planning & Services, Restaurants, Specialty Food, Food, Caterers",1.0,['classy'],1,9
PEb_HioboxCfFONLZzVNTQ,A Ya So Nice Authentic Jamaican Food,165 S Dupont Hwy,New Castle,4.5,20,"Restaurants, Caribbean",,[],0,2
ZzCcljlsQco6WsRDGaV8mQ,New York Pizza & Fried Chicken,309 N King St,Wilmington,2.5,6,"Restaurants, American (Traditional), Halal",1.0,[],0,3
skT9ekzLdiQRg6Wo2OzMvg,El Mana Restaurant,106 N Union St,Wilmington,4.0,24,"Restaurants, Spanish, Caribbean, Puerto Rican",2.0,[],0,4
R1NlqZdqYbs-KXLPXROS-w,Lamberti's Cucina,1300 Centerville Rd,Wilmington,2.5,23,"Food, Pizza, Seafood, Beer, Wine & Spirits, Italian, Restaurants",2.0,['casual'],1,7
5xIcqp5q-6mw1FKaKpRCxw,Chuck Lager - America's Tavern,4500 New Linden Hill Rd,Pike Creek,4.0,132,"American (New), Restaurants",2.0,['classy'],1,2
EQr26hrk8cEYsZjaMVU57g,Kegler's,3031 New Castle Ave,New Castle,4.0,8,"Sports Bars, Bars, Karaoke, Restaurants, Nightlife, American (Traditional)",1.0,[],0,6
FhI8-M6EYtwfrerkWL_VMg,Vincente's Restaurant,5914 Kirkwood Hwy,Wilmington,4.0,79,"Restaurants, Food, Desserts, Bars, Italian, Nightlife",3.0,[],0,6
VKUUdRVElaufzQAI4OcxLQ,Semo's Cart,North Jefferson St W 11th St,Wilmington,4.5,12,"Greek, Restaurants",1.0,[],0,2
FoIzWtiwffKyfKJHsm7VKQ,McDonald's,4160 Ogletown Stanton Rd,Newark,2.0,11,"Fast Food, Coffee & Tea, Burgers, Restaurants, Food",1.0,[],0,5
prGQTaFLeso7Qkzy-lOz2w,Flavor Of India,2671 Kirkwood Hwy,Newark,4.0,25,"Indian, Restaurants, Food",2.0,[],0,3
2b-txFFWmKKq4AL-pnIxZg,Noodles & Company,715 Christiana Mall,Newark,3.0,36,"Comfort Food, Mediterranean, Noodles, Food Court, Chinese, Italian, Asian Fusion, American (New), Restaurants",1.0,['casual'],1,9
l0qTrHzfkquC144PkJh4Rw,Merengue House,837 N Union St,Wilmington,4.0,24,"Nightlife, Caribbean, Beer Bar, Bars, Latin American, Restaurants",2.0,['casual'],1,6
DGatNT8XO1aYuYVYGyWkPQ,Big D's Pizza,3634 Old Capitol Trl,Wilmington,4.5,9,"Barbeque, Restaurants, Pizza, Cheesesteaks",1.0,[],0,4
xHWi7ZQ0zlRoKWlfnmhOYA,Feby's Fishery,3701 Lancaster Pike,Wilmington,3.5,141,"Seafood, Specialty Food, Food, Restaurants, Seafood Markets",2.0,['casual'],1,5
Y9EfIbXryZVWA3IVx86bAw,Olive Garden Italian Restaurant,1279 New Churchman's Rd,Newark,2.5,72,"Bars, Italian, Salad, Restaurants, Nightlife, Wine Bars, Soup",2.0,['casual'],1,7
5oEyGDeqeXeMfFXZdevtFg,Okura Japanese Cuisine Restaurant,703 Ace Memorial Dr,Hockessin,4.0,61,"Specialty Food, Venues & Event Spaces, Event Planning & Services, Japanese, Restaurants, Food",2.0,['casual'],1,6
RO1LyRwH2eZT_eNUN0dC3w,J.B. Dawson's Restaurant & Bar,315 Christiana Mall,Newark,3.5,144,"American (New), American (Traditional), Restaurants, Nightlife, Steakhouses, Bars, Cocktail Bars",2.0,"['classy', 'casual']",2,7
rugDoz-A6vL-FG-8PbvOag,Brio Italian Grille,305 Christiana Mall Rd,Newark,3.5,221,"American (New), Italian, Gluten-Free, Restaurants, Nightlife, Cocktail Bars, Pizza, Bars",2.0,['classy'],1,8
BEbSlK67eM7YnE9O5R7cGA,Papa John's Pizza,2114 Marsh Road,Wilmington,3.0,16,"Pizza, Restaurants",1.0,[],0,2
1h-Irop_Rad5LB9EBf59SA,Five Guys,136 Lantana Dr,Hockessin,3.0,26,"American (New), Food, Restaurants, Fast Food, Burgers",1.0,[],0,5
70a-DEnbsZiYIjMaXnO8rQ,302foodplug,1805 Newport Gap Pike,Wilmington ,4.0,6,"Burgers, Restaurants, Food Trucks, Halal, Soul Food, Food",,[''],1,6
TwZnsqJCFncURCDQoEypSg,Joyful Garden,829 N Tatnall St,Wilmington,2.5,34,"Restaurants, Chinese",1.0,[''],1,2
J1vj7-l7v4jYXxSR6ffPkA,Kyoto Japanese Restaurant,4563 Linden Hill Rd,Wilmington,3.0,51,"Japanese, Restaurants, Sushi Bars",2.0,[],0,3
eBo_ZnzWshp5Myx7ugbMhw,Terra Cafe & Grille,721 N King St,Wilmington,4.0,22,"Greek, Restaurants, Mediterranean",2.0,['casual'],1,3
4mEqLXZD6aU3ymapf_hbIw,Pat's Pizzeria,3604 Lancaster Pike,Wilmington,3.0,24,"Restaurants, Pizza",1.0,[],0,2
bKeKYs8NycSzIYvpT_6ncg,Greenhill Deli-Pizza,2501 W 4th St,Wilmington,4.5,15,"Delis, Pizza, Sandwiches, Restaurants",1.0,[''],1,4
YSJ2WaubNxMCnlNsZfIQbQ,Locale BBQ Post,1715 Delaware Ave,Wilmington,4.0,59,"Barbeque, Chicken Wings, Sandwiches, Salad, Event Planning & Services, Caterers, Party & Event Planning, Restaurants",2.0,['casual'],1,8
Lb5Gi0VnxwtFXk3sMTSMcQ,Fresh Thymes,1836 Lovering Ave,Wilmington,4.5,75,"Restaurants, Breakfast & Brunch",2.0,['casual'],1,2
oa4bCkow1hrF6pqQCT6EGQ,McDonald's,101 S Dupont Hwy,New Castle,2.0,15,"Burgers, Coffee & Tea, Restaurants, Food, Fast Food",1.0,[],0,5
e1D2n12gzzsyCdUdas5MKg,Crab Du Jour - Wilmington,2107 Concord Pike,Wilmington,3.0,8,"Restaurants, Seafood, Bars, Cocktail Bars, Nightlife, Beer Bar, Cajun/Creole",,[''],1,7
WjGfcajYECW1zEoinqpc2A,Panda Express,530 Jfk Memorial Hwy,Newark,3.0,11,"Restaurants, Chinese, Fast Food",,[],0,3
IzUXCIMWeocK1fJHdrgJgA,Naf Naf Grill,60 Geoffrey Dr,Newark,3.5,50,"Middle Eastern, Salad, Mediterranean, Falafel, Restaurants",,['casual'],1,5
oZfUOoDJnORwQrDTqUJ-NA,Mike  & Nick's,300 Lantana Dr,Hockessin,2.0,14,"Sports Bars, Nightlife, Italian, Restaurants, Bars",1.0,[],0,5
LZquQqjVqoWFhVUqfLxUKw,Valle Cucina,4752 Limestone Rd,Wilmington,3.0,75,"Steakhouses, Restaurants, Pizza, Italian, Seafood",2.0,['casual'],1,5
m5fKuw8ZMfYjJLtcISCORg,Noodles & Company,4737 Concord Pike,Wilmington,3.5,26,"Restaurants, Italian, American (New), Chinese, Comfort Food, Asian Fusion, Noodles, Mediterranean, Fast Food",1.0,['casual'],1,9
51Fo_uY52A5oaI8YTHU5yg,Trolley Square Oyster House,1707 Delaware Ave,Wilmington,4.0,172,"Nightlife, Sports Bars, Seafood, Breakfast & Brunch, Bars, Sandwiches, Restaurants",2.0,"['hipster', 'trendy', 'classy', 'casual']",4,7
XjaYTbAMsIOkofZJ4QSuJA,Sleeping Bird Coffee,3111 Miller Rd,Wilmington,5.0,8,"Salad, Food, Coffee & Tea, Restaurants, Breakfast & Brunch",,[''],1,5
sy7uEcDtctaeYqD7HGrPCg,Casablanca Moroccan Restaurant,4010 N Dupont Hwy,New Castle,4.5,102,"Moroccan, Mediterranean, Middle Eastern, Restaurants, Bars, Nightlife, Hookah Bars",2.0,[],0,7
L3CwFF0JhicaxVfWzzrEAA,Bonhouse Chinese Restaurant,4713 Kirkwood Hwy,Wilmington,3.0,39,"Food, Restaurants, Beer, Wine & Spirits, Sushi Bars, Chinese",2.0,['casual'],1,6
Qx6IaAjbIECWWaRuqjYMfw,Panera Bread,5619 Concord Pike,Wilmington,3.0,66,"Salad, Food, Sandwiches, Bagels, Breakfast & Brunch, Restaurants, Soup, Bakeries",1.0,['casual'],1,8
K3ZZua4ab6YLhPqZ_DEDlw,BBC Tavern and Grill,4019 Kennett Pike,Greenville,3.0,109,"Nightlife, Restaurants, American (Traditional), Bars, Beer, Wine & Spirits, Food, Sports Bars",2.0,['casual'],1,8
cbimTBHAiibDpq8O6mP4VQ,Trader's Cove Coffee Shop at Penn's Place,206 Delaware St,New Castle,4.5,36,"Arts & Crafts, Arts & Entertainment, Nightlife, Music Venues, Shopping, Cafes, Restaurants",1.0,"['intimate', 'casual']",2,7
5QPZY59iu3a0C-jWsZR8ow,Charcoal Pit,2600 Concord Pike,Wilmington,3.0,214,"Restaurants, Burgers, Coffee & Tea, Food, American (Traditional)",1.0,['casual'],1,5
